"Because of historic discrimination against minority voters, federal law requires Texas to prove its case before making any election changes."
"As per my understanding, NFS needs both client and server to have the same MTU size."
Tissue allows far less shift in transit than plastic and will absorb moisture.
"So essentially, a small handful of GFCI outlets can protect your entire house."
"Sharks are a common seafood in many places, including Japan and Australia."
"Prepares students to design using three-dimensional digital graphics for games, visual effects, movies, virtual worlds, simulations, and many other applications."
"It's now up to scientists, ethicists, and regulators to clean up the mess and refocus on the road ahead."
Sequential pattern mining reveals frequently occurring patterns from time-ordered input streams of data.
"The lenses reduce glare and enhance color saturation, while protecting your eyes from UVA and UVB rays."
People with mental disabilities can equally participate in community life and enjoy the civilization of modem society.
"Thus, for example, a secure central server may provide authentication services, over secure communications channels."
The rovers' original mission was scheduled for only three months.
The Innovation and Digitalization Lab is the place where innovation and digitalization can be experienced.
Australia does not have a specified university degree that is teaching people best poultry practices.
Those early fair organizers probably never imaged the fair would celebrate food as much as agriculture and dairy.
"They often vary in character set, letter proportions and kerning."
Quads are a great introduction to the world of competitive chess.
"And it provided them with contraception and well-women care, and breast and cancer screening."
"This means that in this context, health data cannot be anonymised."
Postmenopausal women on HRT also seem to be an increased risk for breast cancer and possibly dementia.
"In other words, the alphabet and actual voting order were mere technicalities."
It is not the conservative complaint that national standards usurp local authority over education that tarnishes the latest effort.
The shooting of Valance in a western town at night made Stewart famous and got him elected a US senator.
"The twist rate of the AR-15 barrel refers to the rate of spin in a rifle barrel, measured in inches."
Make sure not to go over this temperature because you could burn the pans.
Linear models simply add their features multiplied by corresponding weights.
"The jobless rate for Asians was 5.2 percent in May, down from 7.0 percent a year earlier."
"Not surprisingly, these required aminos are the same ones found in human muscle protein."
"Sadaani National Park covers 1062 km2, and is located about 130 km north of Dar es Salaam."
"Its not too late to teach others to read, and start scribing to save knowledge for the next golden age."
How high does your school score on motivating your child?
"Lack of Clear Communication – Many hours are spent on communicating goals, performance benchmarks, results, and evaluations."
"Thanks to financial support from many banks and institutions, a specific data system was created and the ResI project started."
This tough perennial will even thrive tucked beneath Black Walnut trees where few plants can survive the toxic soil.
The companion CD has many examples from the book to aid practice and home study.
This places both the IAEA and the states under inspection in an untenable position.
In large food markets most any thing can be found needed.
"For more than 40 years, Computerworld has been the leading source of technology news and information for IT influencers worldwide."
"Hawaii builds it's economy primarily on tourism Market, Department of Defense installments, and in the area owned corporations."
"It is a habitat of various animal species like the Himalayan Monal, Black Bear, and Ghoral."
"In order to succeed, your desire for success should be greater than your fear of failure."
Can there be a hundred thousand millions of omnipresent beings?
These manure and chemical-filled lagoons often leach into underground aquifers.
"The good old days of trading were gone, and the system was commanded by large heavy coins."
Acceptance of sex in public varies widely from place to place.
Students learn how the language works so they become language users.
Oversees boiler and cooling tower water treatment and refrigerant management programs.
Endometriosis usually stops causing problems when you stop having periods.
The second is that obesity induces the proliferation of resident macrophages in WAT (23).
"Other toilet problems include leaking toilets, noisy toilets, and toilets that fill slowly."
"In Arizona v. California, 283 U. S. 423, the validity of the Boulder Canyon Project Act."
"Stains react differently in direct sunlight than when it is overcast, and at different temperatures."
"The Music Lesson: A Spiritual Search for Growth through Music, Berkely Books: N.Y., 2006, Pg."
"As a result, the laser's light output fluctuates, and it needs stronger and stronger electrical currents to keep lasing."
The number of LRCs can be very high in complex networks with a high edge density.
"Meanwhile, China said its foreign exchange reserves shrank by $43.3bn in September to $3.51tn (£2.3tn; €3.12tn)."
This is a special filename that web servers will use when you leave off a filename.
"If we want to charge the lead acid battery, the constant voltage charging method is suitable."
A majority of students at 10 of 16 schools in the county tested below the state average in reading.
"As such, you might face the same opponent more than once."
Stimulant use can cause temporary thought disorder or intensify an underlying thought disorder or hypomanic state.
"Composing a science task needs a ton of learning, and its terms can be very hard to manage."
"God has neither father nor mother, and no sons or daughters."
"Mar 08, 2011· Calcium hydroxide, traditionally called slaked lime, is an inorganic compound with the chemical formula Ca(OH)2."
"The firm found that local crime labs take 30 weeks, on average, to test rape evidence kits."
"Istanbul, visited by millions of people every year, has a beautiful history."
"This was the discovery that if you fermented grains, you could produce alcohol."
"After 1906, federal courts naturalized many immigrants, however, other local courts continued to naturalize as late as 1985."
Because the data you collect can't help you if you don't understand it and use it to shape your decisions.
"The Medical School is noted for innovation in education, biomedical research, clinical care delivery, and local and global community service."
Cardiomyopathy – Cardiac catheterization has been used to measure blood pressures in the various cardiac chambers to diagnose this condition.
The State Government is reducing red tape by removing the duplication of that assessment.
The $500 billion of tax increases and spending cuts scheduled for early 2013 would probably cause a new recession.
Teach all of the specific skills required in active treatment plans.
"Although they were not large, the 43 factories employed 210 laborers."
Rare autosomal recessive syndrome of extreme insulin resistance due to mutations in the binding domain of INSULIN RECEPTOR.
The relevance of these findings to the mechanism of freezing inhibition is discussed.
Recovery from open surgery usually requires 3 to 5 days in the hospital and several weeks at home.
"Treatments at inpatient facilities may consist of behavioral therapies, the most popular of which is Cognitive Behavior Modification (CBT)."
"That, combined with advances in agriculture, public hygiene, and medicine has made large cities possible."
"Opening to God: A Guide to Prayer, Thomas H. Green, S.J., Ave Maria Press, Notre Dame, IN, 1977."
The concept of glycemic load is based on the fact that different carbohydrates have different effects on blood sugar.
"In June, adult Japanese beetles emerge from the soil and begin feeding."
"The public-employee representatives were paid by the unions, and thus beholden to them."
Find out just how much it costs to put the ISS into space.
Development economists and aid watchers contend that external aid received by Bangladesh since independence exceeding $29 billion.
"If they've received their flu shots, they're well on their way to being protected against sickness."
Amblypygids are also known as tailless whip scorpions or cave spiders.
Granites and marbles are quarried throughout the world in a variety of colors with varying mineral compositions.
These figures do not include deaths related to the Colombian armed conflict.
The skewed way that presidential campaigns operate probably drives down voter turnout rates as well.
The research is also showing a strong relation between pet's owners and their pets.
"Chinese characters are extensive and profound, and some words with similar meanings are easy to be misused."
Legris' procedure is to attach one or two photographs to a larger masonite surface.
The contributions paid to a money purchase pension (or defined contribution) scheme are used to establish a pension fund.
"Our priority is equipping divers with the training and knowledge required to succeed, and be safe in their new careers."
Learn correct techniques and practice habits needed to reach full potential.
Having an accessible home where people can interact and integrate with one another is a big part of multigenerational living.
Check out these tips to learn how to tie a room together.
Being invited to take part in grand negotiations about the whole of the government's finances could give Republicans a face-saver.
Red Low Level Laser Therapy with sufficient power and density results in improved oxygenation and circulation.
It is hypothesized that IgG in the tumor region undergo proteolysis and their products appear in the circulation.
FLR aims to improve both human well-being and ecological integrity.
"Not only that, government health agencies aren't to be trusted when it comes to health advice."
"Mammal Species of the World: A Taxonomic and Geographic Reference, 2nd ed., 3rd printing."
Research about gangs is often intertwined with research about gun violence and drug crime.
"Research shows that most people with Meniere's disease respond to treatment, although long-term hearing loss is difficult to prevent."
There was a lot of technical jargon which made it very difficult for a first timer to understand.
The partnership is ushering in the future of toxicity testing.
Scientists from Tel Aviv University are experimenting with silver halide optical fibers for transmitting mid-infrared light from carbon dioxide lasers.
The trash in various communities and roads seems to end up being everywhere.
Key informant interviews were conducted to validate the available information on the systems identified.
This occurs because there has been no consequence to this behavior.
In April 1915 Monash commanded the Fourth Infantry Brigade at Gallipoli.
"All training programs are led by geotechnical engineers with many years of consulting, teaching and modeling experience."
"Empathic over-arousal, personal distress, and egoistic drift are discussed, and the extensive evidence for an empathy-helping relationship is reviewed."
"The better prepared a child feels, the less likely she is to make a fuss."
"In fact, an astonishing 498 of those 680 were not blind at all - or even partially sighted."
"Christmas was on the outs as a major holiday during the start of the Victorian period, he wrote."
Most foods you eat yourself are acceptable for young children.
"An element that visitors are responding to on a Web site, such as an image, a newsletter, or an e-mail."
The National Electoral Commission (NEC) judged both elections free and fair.
"This limit is a frequent obstacle encountered, if not discussed, among hobbyists seeking to make high altitude balloons."
"In fact, some biases may be helpful to keep us safe."
"It provides referral to drug assistance programs, helps seniors choose the best program, and can help with the application process."
"Because Symington's answer, for those with ears to hear, will tell you the meaning of life."
"They rely on sports coaches and trainers to give them honest and unbiased assessments, advice and encouragement."
"Smaller businesses often operate reactively, by responding to opportunities that come their way."
"The United States isn't, however, the only country to control military bases outside its territory."
A: Extensive research on both children and adults suggests that skills training is most effective when certain principles are followed.
"When that happens, everything within the house that is touched by the collapsed roof is most likely destroyed."
The health and safety of your child is always a primary factor while children are in our care.
The drag system is one of the most important mechanisms in any spinning or baitcasting reel.
"The report, issued in March, 2004, makes the following recommendations: - Develop and execute a comprehensive human capital management program."
"Jan 24 Eligio Celestino, composer, dies at 72 in the year 1812."
GDBGX-20 Fiber Laser Marking Machine: The most effective marking technology available on the market today is laser marking.
Knowledge on the anatomical basis of the barrier to ROL in various species is scant.
Chia seeds are tiny seeds with nutritional properties that match the ones obtained from flax seeds.
Another great approach to cut costs would be to repurpose and reuse material.
He held the command of the Ceylon Defence Force from 1931 until 1935.
"Despite profound concern in southern Italy, efforts to find the wrecks and identify their cargo have been slow."
"As with many complex and controversial issues, the humanities can bring fresh and unique perspectives to the discussion."
"Soil strengthening must be done first, a two-week process especially important in windy areas or earthquake zones."
Controlling for observer bias and what may have represented unrelated progress over time in these studies is not possible.
"Combining writing with music, songwriting can be a powerful way to express deep-seated emotions."
They help in reducing heat loss and therefore lead to lower energy consumption.
The others were naturally mummified by the cold and dry conditions of the places where the people died.
"Shaktism reveres the Supreme as the Divine Mother, Shakti or Devi, in Her many forms, both gentle and fierce."
"Start the day right with fruit, a high-fiber cereal, and a source of protein."
They would end practices among cattle and hog buyers that may lower prices paid to farmers and feedlot owners.
This evidence will be used towards the promotion of school readiness in young children in Canada.
"Which, after all, probably isn't the case if all you know about a machine is its MAC address."
Jillson taught geology in Lexington at the University of Kentucky in 1918 and later at Transylvania University in 1947.
Simple examples include taking the sum or the sum of the squares or the average or the maximum value.
Tammy Baldwin of Wisconsin also became the first openly gay candidate to win election for the U.S. Senate.
There are two major classes of items in Simulink: blocks and lines.
The acute onset of chest pain coupled with shortness of breath is a sign of trouble.
"Much economic activity still occurs in the informal sector, and is not reflected in GDP data."
They inferred the presence of dark matter clumps by measuring a slight elongation in the shapes of nearby galaxies.
It was not possible to determine whether any of the motor vehicle accidents were the indirect result of combat operations.
"What are the toys, gadgets and snacks of the future?"
Practical tools such as calculators have been neglected by many marketers.
This Hebrew word literally means to return to sanity from Self Inflicted Nonsense (SIN).
"They can play the role of guides, storytellers and documenters of history."
This is the first time these rare paintings have been seen outside India.
"Balsamic vinegar contains polyphenols, antioxidants that can protect the body from heart disease and cancer."
Another reason to avoid carbs at night is they can make it harder to get a good night's sleep.
Drought conditions are still widespread and extend into Mexico (Supplement Figure 5).
Recommended: Successful completion of MATH 1314 - College Algebra or concurrent enrollment in higher-level mathematics.
Behavioral health facilities renovation and research have been identified as a critical priority for the state and region.
But many people can find a better deal by buying their own health insurance.
Also there were vastly different interpretations of what self-management meant for those engaged in it.
Science has come to realize that micronutrition includes many important components beyond just vitamins and minerals.
CropFax helps farmers to improve crop yields by making the seed selection process more simple.
"A range of volcanoes erupted around the ancient seabed, sealing the salt and trace minerals from modern pollutants."
There is the ability to analyze that data more quickly in very large data sets.
The Kadla is traditionally worn by the Koli community of Gujarat.
The novel told the story of the Battle of Gettysburg from the point of view of the men fighting it.
This can make it hugely challenging to understand and analyse any historical data.
"These genes are responsible for many characteristics, including hair and eye color."
We teach an enquiry based learning where each topic will have a question in which students will work towards.
"It is like water, tumbling from stream to river as it seeks finally joining its mother, the ocean."
Adopting healthy behaviors is an important step in fighting this disease.
Izon's qNano uses nanopore-based technology to overcome the limitations of optical measurement methods.
"Discolored water will be temporary and is not harmful; however, the discolored water might stain your laundry, especially white materials."
The school's overall operating and capital budgets are determined by the County Executive and County Council.
This can identify the distance from the hotel to certain landmarks or the airport.
"Aspects of sex will not vary substantially between different human societies, while aspects of gender may vary greatly."
Many in the hour of tragedy sought to find reason in such an irrational act.
To withstand the ambient temperature up to 55 centigrade and 95% humidity.
There are many roads to the truth but the truth is singular.
"But other weathers, severe and historic, have challenged the Mediterranean image."
"Implying, of course, that Catholics teach one is justified by their works, and not by faith."
Perhaps libraries should make a concerted effort to teach everyone in the country how to use BitTorrent and other services.
Google stores the information collected by the cookie on servers in the United States.
Spanish forces captured several British posts in this territory and therefore claimed a significant part of the southeastern US.
"It's been a great teaching toy, showing her how pieces work together and how things can move."
Scientists have shown that familiar images prompt spikes of electrical brain activity that indicate recognition.
December 7 is an early dismissal day for all students.
These nutrients support metabolic function and restore the immune system.
Hiziki has been a traditional part of the Japanese diet for centuries.
They fired tear gas canisters at the students to prevent them from entering their classrooms.
These regulations date back to 1830 (though the rules have been significantly revised over the years).
"Many mobile devices, such as PDAs and cellular telephones, have a limited ability to display particular types of content."
The planning process begins with stakeholders submitting proposed projects for review.
Students need to be careful to note WHERE (which campus or extension site) COURSES ORIGINATE FROM.
Could reovirus cancer treatments cause an individual to develop celiac disease?
Cut into halves and dip in acidified water to preserve color.
Insufficient financial leverage is viewed as a major obstacle preventing women from being politically active.
"Property policies provide only nominal coverage ($10,000 or less) for clean-up of contaminated property following a covered loss."
In the same clause it denied voting rights to persons convicted of a crime.
The prospect of inflation could decimate bonds of all credit quality levels.
"Two decades ago, the focus for security was network security and protecting the perimeter."
Look at the ratings for crime and ensure that the community has a low one.
This is very helpful and gives us a base to start with.
"Thus, if you control the air quality and eliminate the excess humidity, you can reduce the spreading of mold."
"Before placing any concrete, slabs are to be inspected by the supervising engineer or appointed representative."
Doing this on files with limited access gains the local attacker higher privileges to the file.
How Can I Avoid Paying Taxes on Land That I've Sold?
"If the DNS server is overloaded, you may be unable to view some or all websites."
Increase family time Experts suggest that families spend more time together when tragedy occurs.
Looks like someone just gone too far... Human brain is a huge neural network with enormous capabilities.
"The Israeli military had surrounded the camps, and taken over the whole of West Beirut, on September 15."
The Pacific Grove Natural History Museum has helped with training and identification of birds.
"For example, what is the value of taking notes when a lesson can be video recorded and posted online instantly?"
"A traditional House uppon a hill, by the sea, overlooking the surrounding islands and the Aegean sea."
"Another is James Morton Callahan's History of West Virginia Old and New and West Virginia Biography, 3 vols."
"Lapis Lazuli is a rich blue color, used in ancient paints and rituals."
Officials from the Ministry of Environment did not respond to Al Jazeera's request for comment.
Lots of states don't mandate that a doctor carry out laser treatments.
Renormalization greatly increased the accuracy with which the structure of atoms could be calculated from first principles.
She raised awareness in her community of the link between cancer and pollution.
"The Dutch civil navy, tasked with transport of government goods, charting sealanes and countering piracy, was militarized in 1939."
The women's group intervention involves social mobilisation and group membership and activities are not restricted to women of reproductive age.
Many churches are part of this charity organisation that is involved in feeding the low income.
Part of the lag in output was made up in 2003-07 when GDP growth exceeded 5% per year.
Understanding why fat is helpful and necessary changes many people's perspectives about this crucial energy source.
These options remain limited despite (justifiable) congressional interest in Myanmar's ongoing human rights abuses.
Just think how few people are even willing to prepare a balanced course for teaching or non-slanted teaching.
Its deployment is thought to cost a tenth of what laying fiber costs.
Jump to: Introduction | History | Recent Updates to Looney Tunes & Merrie Melodies: The Early Years.
"RUSMP has developed an extensive array of STEAM programs, courses, and interventions available to teachers, teacher leaders, administrators, and students."
"In the present study, tear samples of 20 patients who were affected with NLD obstruction and APS disease were analysed."
"After the discovery of CFC problem in mid seventies, ozone destruction by active chlorine lO has become a dominating question."
"This resulted in the development of reduce, reuse and recycle programs."
"To detect the size and exact shape of material defects, it is necessary to determine the exact field distribution."
"Microsoft had similarly decided to release its own competing Windows Media Video codecs as a published standard, known as VC-1."
"In geographical areas requiring hurricane-resistant construction, laminated glass is often used in exterior storefronts, curtain walls and windows."
The expression of the emotions in man and animals.Chicago: University of Chicago Press.
The public services in the town need to be invested in instead of cut.
I may not have all the knowledge to articulate the patterns in educational foundations and theories.
It's this combination of tourism and real estate marketing that helps communities realize their economic potential.
Oil from tar sands leads to significantly more greenhouse-gas emissions than conventional crude.
Signals from these types of electronic equipment can sometimes interfere with the recording.
"More and more young people are graduating from college with significant student loans, $23,000."
"Methylsulfonylmethane supports healthy skin, fur, connective tissues, reduces pain and swelling."
"This clean, nutrient-rich water produces what are recognized as some of the finest oysters in the world."
It is specially designed to achieve maximum water sprinkling at the tip of nozzles with minimum pressure drop by gravity.
"In one of his early experiments, Smith and his colleagues put 3- and 4-year-olds in two different play settings."
"As the northern Pacific storm system comes alive each winter, powerful swells begin marching across its vast expanse."
"Meantime, accountability is diffused by hierarchies that obfuscate clarity of command."
