"The annual population growth rate (2011 est., CIA World Factbook) is 1.284%."
"In addition, these colors weren't confined to a province but rather irregularly scattered across various regions over all of China."
A family member or a support person may stay with a patient during recovery.
"The new development will therefore create connected spaces, accessible rooftops, pathways and passages."
Academia in business includes business training at the business certificate level.
"However, patients with cancer-related emergencies can begin their treatments sooner."
"All throughout the book, Barry introduces excerpts from Bishop's poems and archival images."
"The flowers are blooming, the birds are chirping, and the bees are assembling for their annual suicide attacks."
"If this doesn't happen and the rash worsens, you should consult your doctor."
"Also, used in humidifiers (3 – 4 drops per gallon of water)."
A. Baptism testifies to believers that God has cleansed them from their sins through Jesus Christ (Acts 22:16; Col 2:11-14).
"The systems technology and operation is fantastic, it will have a huge impact on water conservation."
This is therefore another factor that we consider when selecting food items.
Our mission is to send a message to kids everywhere about the importance of staying in school and loving it!
"Children are killed and disfigured on our roads every day, and every day we fail to stop the slaughter."
All animals are built (by the process called evolution) to survive in the normal place in which their kind live.
These may be signs that your child has an autism spectrum disorder.
Households with gardens were more likely to own cats and dogs than households without gardens.
These can help guide you through overcoming and preventing jet lag.
"Sri Lanka is a country in South Asia, located on an island once known as Ceylon."
"In simple terms, how exactly does a tractrix differ from an exponential horn in its design?"
AdWords is considered to be one of the most effective Internet marketing strategies today.
Link impedance measures were also assigned to the local access links.
"Mestizos, or mixed Spanish and native, come second; Natives come in third; while Afro-Peruvians come in fourth."
I am primarily interested in determining the component from the high voltage power lines near my house.
Did you know you can tell the temperature by looking at the way the rhododendron leaves are curled?
Posterior uveitis can develop slowly and often lasts for many years.
The idea is that a banker or foundation decides to fund a particular service or program.
The London College of Communication experience is all about learning by doing.
Capital regulation seeks to address this by way of risk weights.
Smaller universities are being consolidated while professors have strict targets in terms of publications in peer-reviewed research journals.
We use financial mathematics and an analytical eye to help banks understand the risk drivers within their lending portfolio.
"Alhambra Fire Department was only established in 1906, three years after it was incorporated as a city."
"To determine your interests, Google will track your behaviour across the web using cookies."
The third transmission line is a proactive step to improve reliability of power transmission.
There are an estimated 6.5 million adults who have suffered domestic abuse.
During the first 20 postwar years the shire's population steadily increased although not as rapidly as in the 1920s.
High Ultrasound Mechanical Index High ultrasound mechanical index values may cause microsphere cavitation or rupture and lead to ventricular arrhythmias.
United States writer of poems and plays about racial conflict (born in 1934).
Understand how to let go of the past and practice non-attachment.
These shortcomings amounted to non-compliance with at least four of the eight data protection principles under the Act.
"In any case, each cell represents an area dx∧dy in the XY plane."
"With the development of the industry, the competition of the plastic film manufacturing industry is increasing."
The team behind the study interviewed children between the ages of 9 and 14.
The refugees were taken to the detention centre to be processed.
In this short résumé I cannot possibly exhaust the many ways in which we can observe single particles.
The two kinds of emulsions most pertinent are the anionic and cationic types.
"By using ring signatures and stealth addresses, Monero can protect both the sender and recipient from snooping eyes."
"American Heritage Dictionary of the English Language, Fourth Edition - v. To joke or quip."
"Front Page Titles (by Subject) CHAPTER V.: Of Adam's title to sovereignty, by the subjection of Eve."
The program is intended to support innovation and entrepreneurship in India.
"SAP, for instance, leverages webinars to showcase its software capabilities in helping organizations do business better."
"ISSN 0007-1005 Christie, Donald (2006) The new standards framework for Scottish teachers: facilitating or constraining reflective practice?"
"He was the son of the famous painter and art historian Léonor, and was close friend of Stendhal."
The rules for dividing family property can be very complicated.
To learn more about the High Point campus project click here.
"If man was predestined, the concept of good and evil could not exist."
It brings us into the present so that we may fully receive what each moment has to offer and teach.
"In VMware's new certification matrix, the original VCP exam is now called the VCP in datacenter virtualization (VCP-DV)."
"Suppose, with the LPP in mind, she insists that the child will have no life-prospects that she deems acceptable."
Saliva from a cough can travel at about 50 mph.
Let's say that you have $500 in debt each month due to a car payment and an old student loan.
Many of the struggles your child has faced in the school system will be eliminated simply because of the environment.
The National Museum of Natural History is open daily from 10 am until 5 pm except on Mondays.
Core aeration prior to an application will facilitate the movement of the grubs into the root zone.
"We'll want to know why, in light of his understanding of God, Jesus himself believed that he needed to die."
"Resulting from rapid digital development, the quantity of sources of information significantly greater."
The use of written worksheets will also provide all persons involved with a clear and permanent record of the information.
"This action sets up a chain reaction that once begun, will cascade and result in changing a living cell."
"Journal of College Student Retention: Research, Theory & Practice, [URL] Metcalfe, A. S. (2018)."
How to donate blood Simply call 1-800-RED CROSS (1-800-733-2767) or visit redcrossblood.org to make an appointment or for more information.
"One student mentioned that we say 'a pair of trousers', or 'a pair of scissors'."
"The points, mounds, curls and empty spaces overlap and frame each other in ethereal microcosms."
You must know exactly what to do in order to have fresh indoor air at all times.
Consumers can achieve supercomputer-like performance of more than 500 gigaflops compute capacity and enjoy rapid content transfers via USB 3.0.
"Located on a 250-acre site, this project includes 492 high concentration photovoltaic solar trackers from the manufacturer Amonix."
"Since the most reliable material is tile, its various modifications began to appear – soft bitumen and metal."
Find out how these regulation changes can help borrowers access capital.
Our tax system would not be legitimate if the burden were borne only by labour.
"How many people would drive a car, if they had to take care of it themselves?"
Learn about the different types of barkers and discover how easy it can be to change this unwanted behaviour.
"The researchers found positive associations between length of musical study, scores on executive functioning tasks, and performance on intelligence tests."
It is just a way to name a variation of pressure.
Effective against wide range of soil and seed borne plant diseases.
"We improve the lives of children and young people throughout the UK who are sick, disabled or disadvantaged."
And an instrument too for investigating the varieties of conflict that can give rise to paradox.
A movement to end all forms of discrimination against people released from prison.
Many of their studies rely on the N.C. Education Research Data Center.
And what can you actually take away and use from their examples?
The city stretches approximately eight blocks from the Atlantic Ocean to the bay at most points in town.
"The Christian gospel would be preached as a witness to all nations (Matthew 24:14, Mark 13:10; Revelation 14:6)."
"Deuteronomy 23:17-18 There shall be no whore of the daughters of Israel, nor a sodomite of the sons of Israel."
"What would they think of the black and white images, let alone the chemical distortions?"
"Three forms of student performativity have arisen - bodily, participative and emotional - which threaten the freedom to learn."
Most parents recognize when a child with ASD may have some deficits in social skills.
"The rebalancing of LNG market will be driven by strong growth in Asia gas demand, especially in China."
There are many theories as to the cause of BPD that are being forwarded by professionals.
Mice and trackpads are designed to process commands to the PC or system.
"Its followers have over time considered anything, animate or inanimate, to be sacred and aspects of divinity."
"Since the brick sinks when out of the boat, it must be more dense than water."
"Often the avocado seed is tossed into the bin or compost pile, or sprouted to create an avocado tree."
"We would just write ideas and write ideas, and go over it and over it."
Obviously some type of definition of openness in education would be helpful.
Misunderstanding the relationship between Christ's atonement and God's judgment can cause us to read the Bible for the wrong reasons.
Thus may circumstances alter the course of a mans life.
It decreases the immune reactions and is thus used to prevent the rejection of the organ transplants.
Puente's paintings are rich in personal narrative and draw on dreams and visual stories she invents.
Tyrannosaurus Rex was roughly 5 to 7 tons in weight.
"Developed to facilitate participation in national and international competition, the Olympic sports organization provides structure for competitive skiing and snowboarding."
"Influenza-specific antibody responses were assessed for antibody concentration (Bmax), relative affinity (Ka), and hemagglutination inhibition (HAI)."
"Consider the following ideas to incorporate new and innovative design, technology and eco-friendly products into your bath this winter season."
"In addition, each ministry that works with or among children provides ongoing training specific to its ministry's needs."
Light is delivered to the microscope through a single-mode fiber optic.
"If so, thats the most likely cause of acidic urine."
"The Online Learning Center offers online resources for instructors including PowerPoint[registered] lecture slides, and complete solutions to homework problems."
"That, in a nutshell, is the absurdity of the love-hate relationship of Israel with France and the French."
"PISSARRO'S PLACES examines the seemingly simple landscapes painted by Impressionist artist Camille Pissarro, revealing baffling details and futuristic elements."
"As a result, the outstanding balance of the loan actually grows larger with each payment rather than smaller."
"The room is designed to keep children busy and happy - including books, toys and TV."
"Finally, under duress, in 1877 they began to migrate there."
"Safal 71% SG is a non-selective, post-emergence herbicide for the control of annual, perennial, broadleaf and grassy weeds."
"Home cleaning is typically done through the day, when the clients are at work or away from home."
The road to a diagnosis for most MND patients is long and arduous.
Yet his book Emile became a celebrated Enlightenment treatise on how to educate children.
Adult cichlids should be fed 2-3 times a day while the fry should be fed 5-7 times a day.
"The demonstrations in Tehran against the government are huge, as has been widely reported."
"Every three years, with around one hundred artworks mounted in situ, the festival represents a key art event in Asia."
Native Hawaiians were forced to abandon their traditional dress in favor of missionaries' standards of modesty.
"The idea is not to cook the meat, but simply to warm it through."
Trowulan are scattered red stones temples remains of the once mighty Majapahit Empire which in 14th century controlled the archipelago.
"Minimum qualifications include a Ph.D. in Physics, Chemistry, or Geology by the start date."
"Genes control everything about us, including the way that our body grows and functions."
The way in which academics work and think will vary depending on their discipline.
"Car accidents occur throughout each state, although every state has unique car accident statistics."
"Kasich's plan would increase taxes on legal services, accountants, oil and gas drillers."
Danube Delta - It is the second largest river delta in Europe and best preserved on the continent.
"Deforestation and erosion, aggravated by the use of firewood as the primary source of fuel, are serious concerns."
"In 1823, Kamehameha II, Queen Kamamalu and a few chiefs and women sailed to England."
"Two alternative processes, originally proposed by Darwin and Wallace, differ primarily in the timing of events creating the dimorphism."
There are a number of beloved areas in Glacier National Park.
"Israel has attacked UN schools before, saying that they were being used as safe havens for the armed Palestinians."
"For he learnt this on his way through these Arab tribes, who best understand and practice it."
There has to be a reason to believe that a crime has been committed.
"Nusbaum, H. C. & Pisoni, D. B. Perceptual and cognitive constraints on the use of voice response systems."
A diesel engine that is supercharged by a turbocharger is sometimes referred to as a turbocharged diesel.
Pulse first 4 ingredients in a food processor 3 to 4 times or just until corn is coarsely chopped.
"These false representations confine our collective memory to one of absolute night, forgetting the existence or possibility of sunrise."
People who are mentally retarded or physically handicapped people are set to benefit.
"Rather, it is the more recently developed mathematics of fractals, information theory, and complexity."
It became famous in 1961 when the dam collapsed and the entire water grabbed Pune city.
"Therefore, pushing the yen down has been a central plank of government policy for years."
"All plumages for each species are illustrated, including males, females and juveniles."
A huge jet aircraft (such as a 435ton Boeing 747) can glide to safety with NO ENGINE POWER.
The state's Watershed Implementation Plan (WIP) includes methods for achieving that goal.
"John Brightwell Morton's dates (July 4, 1807 — 1881) are given on his tombstone."
"Our Department will be thoroughly involved, very hands on, and not rely on scientists only."
The art that these men produced in their own wise ways outlived the crushing backwardness of the Middle Ages.
"Example: A 2,000-watt system, that has a total cost of $8,000, is considered to cost $4 per watt."
The intensity of such changes is greatly affected by the climate.
People with autism are sometimes said jokingly to be on another planet.
The benefit of reducing rates on restaurants to 5 per cent will benefit consumers across the country.
We use the model to understand different strategies by which a population may locate some resource in its environment.
Their goal was to find small molecules that could activate the gene for a protein that promotes bone formation.
The Jot of Guru Nanak came in to the form of a Child for many reasons.
These communities are usually economically disadvantaged with limited access to quality healthcare.
"The Halverson Project (HALPRO) is discussed in Matloff and Snell, Strategic Planning: 1941-42, pp."
"Under X, fonts are named by their X logical font description (XLFD)."
"From the lymph node, the melanoma cells can then travel to other parts of your body."
But the researchers also found long term health problems in unexpected areas.
The Arduino supports 1K bytes of electrically erasable non-volatile EEPROM (data survives after power-down) and 2K bytes of RAM.
"Cancerous tissue provides a different electromagnetic signature than normal tissue, the researchers explained."
"Video is the biggest driver of bandwidth consumption, by far."
The implications of the study for risk management are intriguing.
"As tensions grew the loyalists were, under law, permitted to disarm the general population."
The town lies about 15 kilometres south of the Karnataka-Goa border and 519 km north-west of Bangalore.
"Applied research attempts to identify effective ways of dealing with behavior problems in schools, clinics, workplaces, and other settings."
The steam rises and leaves all of the impurities behind in the boiling chamber.
"You must know how to report, interview, and write to the standards of Western-style journalism."
"The subsidy is graduated according to household income and varies according to a handful of factors, including age."
One ounce of pure gold today still purchases the same as it did 200 years ago.
General Sir Malcolm Cartwright Cartwright-Taylor KCB (1911–1969) was a Royal Marines officer who became Commandant General Royal Marines.
"This means that each year 1,000 people with the scientific ability of Einstein will be born."
"Both brown and black bears use the refuge, feeding particularly on early spring vegetation near salt marshes and sedge meadows."
In this book you will learn techniques that will stop your anxiety and panic attacks.
"But before all the new moms start upping their fat intake, let's consider a few factors."
A long retirement extends your exposure to one of financial planning's most subtle enemies: inflation.
"The first rabbi, Itzhak Frankel, also directed the Talmud Torah, which included a dozen pupils."
In most cases social media is how companies interact and communicate with their targeted public.
Each patient was carefully measured by specially-trained physical therapists before the study and throughout.
Taking the time to plan will help to establish goals that are not short sighted.
"The Earth lives and suffers also, because of what is being done to it."
The purpose of IQ and OQ was to verify that equipment and systems were able to perform as intended.
Grebes getting briefly airborne possibly did so to avoid collision with conspecifics that remained stationary on the water surface.
"Because the limited number of disease types and corresponding patient examples, we did not perform stratified statistics."
"Minerals are the natural, inorganic (nonliving) materials that compose rocks."
"The Chinese put silver collars about the necks of these animals, and render them extremely familiar."
Among them were the first experimental measurements of the electrical conductivity of cobalt-palladium in both its liquid and solid states.
Bankstown's ability to think outside the square when it comes to waste recycling has received national recognition.
Social Media Report – Social media has overtaken TV as a primary source of news among young people ages 18-24.
"In most cases, only permanent, adult teeth are reimplanted into the mouth."
The most Kronfeld families were found in the USA in 1920.
"Match the seams, and fold the seams in opposite directions."
"China is the primary buyer of Indonesian coal and received 31% of its exports in 2017, says the IEA."
The Future is Here The science of genetics continues to advance quickly.
"When the class guesses the word, take the flashcard off the board."
"Yet, the presence of oxygen is vital, since it drives thewhole process by removing hydrogen from the system."
Peritoneal dialysis-Peritonitis in India study: An interim analysis of baseline data.
Living organisms are divided into two basic domains: prokaryotes and eukaryotes.
Great step-by-step method for starting and maintaining a garden in Arizona.
This step includes teaching techniques to check and receive a body check as well as safety and rules.
These properties of packing increases the shelf life of food with preserving flavours and colors.
It works by reducing the absorption of fat from the intestine.
"Littering, including throwing cigarette butts on the floor, is an offence."
He was a hero of the Empire and a man of honor.
Clearly there's a relationship between progressives and humanism -- humanism postulates that mankind is the centre of the moral universe.
"To wit, the process we should deliberately subject ourselves to before coming to important decisions, or forming strong opinions."
It is not known if Ruconest is excreted in human milk.
The misconceptions among employers possibly make life difficult for graduates from these university colleges to be hired.
"As the funds and supplies decrease, the number of disadvantaged children increase."
Dumpsters are generally large containers that are used to keep junk before it is obtained and taken to the landfill.
For every geotagged photo we store up to six Where On Earth (WOE) IDs.
Setting up multiple instances of Windows 8 for testing is a common practice.
A better option would be for parents to engage with their kids to talk about their learning.
"For someone who is allergic, these symptoms are uncomfortable and can affect your quality of life."
"But theme parks are, in many ways, the antithesis of museums."
"Despite the extensive damage to residential and commercial buildings, most of the manufacturing and agriculture sectors were largely unaffected."
He seemed unhappy at the idea that the teacher should dress differently from the students.
"It insists that the artist's experience is what gives value to the work, not how long the piece took."
"Diet is an important part of diabetes treatment but remember that with healthy diets, exercise is also necessary."
The most common fixed rate loans are 15 year and 30 year mortgages.
But that great sheet of white ice is also reflecting lots of the sun's energy back out into space.
"Def: Using up of the available scarce resources (especially petroleum, natural gas & coal)."
Their ultimate goal is to design a superconducting material that works at room temperature.
Could be used to inform readers on emerging topics in science.
"He compiled the vocabulary by taking words from English, French, German and Latin."
The fan effectively decreases moisture and humidity levels in the room to prevent growth of mildew.
Estoppel in pais and equitable estoppel are used interchangeably in American legal parlance.
It is abundantly clear that the regime is building nuclear weapons capable of reaching Europe and Israel.
In print production the most widely used CMM is the Adobe (ACE) CMM.
"Furthermore, the opportunity for offenders to give back to communities in need engenders a restoration for previous harmful actions."
Explore every crack and cranny and choose chiropractic as a long-term strategy to keep the entire family happy and healthy.
It can be very challenging with teens being around there friends and at school.
Occasionally college incidents that may involve censorship make the news.
"Talk to your doctor about a healthy lifestyle for your unique body, age, and medical history."
"A grayish, lustrous metal, yttrium is known only in its tri-positive state."
"In China, traffic congestions are caused mainly due to large heavy-duty trucks transporting goods from Inner Mongolia to Beijing."
There are basic elements of passive energy buildings which use the form and materials to provide comfort.
In the sensors equipment of the boats it was also installed one MIRADOR electro-optical tracking and fire control system.
The only exception to this is that S comes before A (for no clear reason).
"Hence, it is more than apparent that Americans do not consume a sufficient amount of dietary and functional fiber."
More than 100 houses have already been built but more than half are still living in tents.
Boeing's transformation of Renton shows an appetite for growth that contrasts sharply with the gloom in much of U.S. manufacturing.
Be sure to spend sufficient time on the detailed carving of 16th century Venice.
"Imagine a place where nature abounds, and music fills the air."
"The education in high school and university is in English, but the national language of Zambia is Bemba."
"Separate data entry fields are established for first (given), middle (given), and last names (surnames or family names) of individuals."
Chapter 2 - Using Traditional Rulerships Here you'll find many practical examples of charts analyzed using traditional dignities.
The following example shows how to cite the use of this data set in a publication.
"However, beneath the apparent stability of the political and economic order, immense internal pressures were building up."
This arbitrary data restriction eliminates the possibility of accurately comparing—at the household level—welfare-participation rates between immigrants and natives.
"Marble is undoubtedly one of the world's most lavish natural materials, and some varieties are even more prized than others."
"In Patna alone, hundreds of roadside vendors, mostly poor men and women, sold these items."
Some require daily feedings while other lizards can be fed a few times a week.
