"Read what you can, learn what you can, then make informed decisions and run with them."
"In fact, as courts are broadening the definitions of discrimination and harassment, these claims can only be expected to rise."
What are the challenges faced by artists in the Arab world?
The scientists conducted electrical and chemical studies on these altered frog eggs to determine the function of the receptor.
The plant appears to have no toxic effects even when used for months at a time.
"In addition, because the Texas market is so big, the adoption of health textbooks here has a national impact."
National Student Loan Database (NSLDS) NSLDS is the U.S. Department of Education's central database for student aid.
"The Reformer's adjustable springs allow for progressive resistance, which helps to lengthen and strengthen the muscles rather than building bulk."
Ask friends and family to help prepare for a project – haul off used material or pick up new material.
Contributions à la connaissance des Araignées (Araneae) d'Amérique du Nord.
"Today they control Congress, the White House, the mainstream media, and both political parties."
The principle is no different from the food you put in your body.
The latest information on the status of state parks can be found on the DNR's web site.
"Because of this, most coral reef management efforts have focused on Saipan."
Metabolome analyses showed that both types of MoS2 exposure changed the metabolic profiles of the intestine and intestinal microbiota.
The legal argument turned upon whether there a real chance of physical harm in flying a light plane.
"On 26 November 2007, the UN General Assembly named 20 February as the annual World Day of Social Justice."
Big service providers have found numerous tactics to reduce customer anxieties when it comes to using their service.
"As such, admissions committees search for students who have already demonstrated an ability to lead."
"However, there is no consensus as to the proper level of public benefit and how much the government should do."
"Drug overdose causes the following symptoms: arrhythmia, gastralgia, depression of the respiratory center, vomiting, tachycardia, nausea."
"The group discussed the accuracy of current diagnostic tools, expected outcomes, appropriate assessment models and study designs."
"You need to work out how many Vusers the CPU can sustain, and how many the memory can accommodate."
"If your basement has flooded, there are some really important things you should know."
"View more than 2,000 animals representing 180 species from around the world."
The Cabinet-level President's Interagency Task Force (PITF) is statutorily directed to coordinate federal efforts to combat trafficking in persons.
If not properly fed the body of the Spiny Sea Cucumber will slowly begin to shrink.
"Ohio is bounded by the Ohio River, but nearly all of the river itself belongs to Kentucky and West Virginia."
"In fact, about 20 percent of women in the United States now have their first child after age 35."
It helps fight bacteria and viruses and protect you from damaging pathogens.
Another practice of vocab: expressions used to describe the weather and seasons.
Both animals kept as pets and animals raised as livestock are routinely vaccinated.
No human data on the effect of furosemide on fertility are available.
"Zac answers questions from students about Ajax, WordPress, and shortcodes and more."
"They planted their carefully hoarded wheat seed, and eagerly watched their precious crop grow."
"There are many more types of dog collars like training collars, slip collars, flat collars, and martingale collars among others."
"In 1992 a new, Greek-speaking brotherhood brought new life to the Skete."
"They created the Nimbus 195, which is a fully enclosed carbon fiber monocoque body for a drone."
"Sometimes an astute clinician, or a set of clinical observations, drives the basic research in fundamental ways."
Does the school have connections with community institutions and outside agencies to enrich the learning possibilities of students?
"People compare past Muslim immigration with the present, but this is wrong."
It is a chip that processes the information or data needed to run programmes or perform tasks.
DNA Face Matching only offers a hypothesis or suggestion of possible relationship and is occasionally incorrect.
"Are the self and the environment two separate entities, or are they one?"
"On average, someone's home is broken into every 12 seconds whether you live in Hickory Corners or elsewhere."
About Crude Oil Flammable liquid consisting of hydrocarbons found underneath.
"Our current criminal justice system helps no one, including victims of crime."
"Investors should carefully consider the fund's investment objectives, risks, charges and expenses before investing."
This suggests that unwrapping a cross product might be related to the equation of a line.
"Its walls were broad and high, with twelve gates guarded by twelve angels."
"While they create jewelry, purses, scarves, and other items they learn proper health practices and receive encouragement from each other."
"Fertilize late summer with a LOW nitrogen fertilizer, 14-14-14 (or something similar)."
"We often use Open Source technologies, like Perl, to get the job done."
Finding fulfilment in life starts with understanding WHY we do what we do.
This reduces pain and keeps muscles from wearing out as a result of nerve pain.
"In 2008, the Transportation Department initiated a review of the TMP code requirements."
"They are dangerous and deliver extremely high rates of UVA rays, sure to damage skin and worse."
Within the border the flower and vine motif repeats in a narrower scale.
This database is an index to death records for the state from 1970 through 2001.
"If you have the means, consider leaving money or property to a local rescue group or shelter."
"It starts from framing the business question, to buiding and deploying a data model."
"So the deadly health issues that result from this gradual poisoning are heart disease, strokes, emphysema."
Weak law enforcement and high levels of government corruption allow smugglers to operate with relative impunity.
"Students will be able to identify word pattern, specifically the -ought family."
"However, during the Middle Ages it was usually twelve years old."
There is the possibility of serious injury or death if the defect is not corrected.
The optimal storage temperature must be continuously maintained to obtain the full benefit of cold storage.
"Silicon IP include solutions for example for imaging, Bluetooth and IoT, WiFi, among other various application areas."
AntiEvolution.org provides concise and accurate information for those who wish to critically examine the antievolution movement.
Electronic Cigarettes : They may separate the chemicals which enter our body.
"This pattern has full descriptions, diagrams, written directions and charts."
This has also resulted into destroying the natural habitats of various species of birds and animals.
"Their first priority was not meeting the physical needs, but meeting the spiritual needs of people."
"Although much is known about embryonic neurogenesis, little is known about the genetic control of postembryonic brain development."
"Patients are encouraged to participate in 12 step programs such as AA, NA, and smart recovery."
Three lines of research now clearly establish that foreclosure by public auction is seriously flawed.
"Mugridge, John Hamer, John G. Hosking: Physics in a Statically-Typed Programming Language."
"There is this song named 'We Shall Overcome', a tribute to Martin Luther King."
"He served as judge advocate of Camp Chase, a military prison located in Columbus, Ohio, during the American Civil War."
"Right now, most Internet-access plans are priced by speed — faster plans cost more; slower ones are cheaper."
"The largest group of voters who smoke are lower- to- middle class, this translates into a tax increase."
Patients Sixty-eight children aged between 2 days and 14 years.
Commonly Asked Questions about Service Animals in Places of Business.
"That's why the health law, the Affordable Care Act, is so crucial."
"Our children play on the river's banks, swim and bathe there."
In the interim several students combed the book for typos.
A proposing institution must provide clearly documented evidence of a strong existing academic program in cybersecurity.
All profits from the sales of our goods go towards funding Oxfam's work around the world.
The researchers drew blood samples all three days so they could watch what happened to the timing of gene activity.
"It was, instead, the substance through which light waves were thought to propagate."
"You check your peak flow with a peak flow meter, an inexpensive device that you can use at home."
Protein chips have emerged as an approach for identification of DNA:protein interactions(5) .
This course will help you master the basic vocabulary upon which most yoga traditions are based.
"Why move from a city of 90,000 citizens to small municipality of 1,300 citizens?"
"But longer term, manufacturing will likely shift away from the U.K. and into the EU."
"In order to stay fit or healthy, people should put their best possible efforts."
Gruber's thesis that abortion caused America's crime drop is almost certainly false.
A demonstration reactor is expected to start producing electrical power from fusion energy in the 2030s.
"Agricultural chemicals can linger in the environment for years, affecting our children's future."
"Frilled sharks' gestation period may be as long as three and a half years, the longest of any vertebrate."
LAMP Probabilities and Thresholds for Flight Categories Bar graphs indicate the probability of selected flight category element.
"The liquid and fine powders that make it through the sieve are dried, leaving the useful arrowroot powder behind."
It is instead used to remove localized areas of stubborn fat after patients have attempted other natural weight loss methods.
Anyone and everyone can volunteer to become a donor and thus give a patient a better chance of recovery.
"For this reason, cases continue to occur in areas where the disease had not previously been recorded."
"Without vitamin C sources on board, an entire crew could be wiped out from scurvy on long voyages."
"So I'm really talking around the subject here, which is the book A Confederacy of Dunces."
"The Big Dipper is part of the constellation Ursa Major, otherwise known as the Great Bear."
"There are appointment of examiners; examination of member banks, State banks, and trust companies; as well as reports."
The left eyelid was temporarily not working because it is enervated by the left facial nerve.
"Invented in European France in the 17th century, it slowly started moving to Las Vegas in America."
See information above for self-isolation for residential and non-residential students.
The fact that respondents might some-times not answer questions in a way that corresponds with reality could be limiting.
In this article we offer 7 specific reasons why to include krill in your shrimp feed.
This is essentially the conception Newton and Leibniz worked with.
Overcrowding of trees can inhibit healthy growth or push branches and roots too close to your property.
"Dominique Strauss-Kahn, chief of the International Monetary Fund, agreed on Monday that the rising East is a transforming global force."
Even light or moderate drinking can affect the developing fetus.
Try and limit the amount of time that your hair is exposed to these conditions.
This is the first step to get into the Public Mental Health Service in Nova Scotia.
"William Windsor was a proponent of phrenology, the study of the human skull's shape to determine mental faculties and character."
The additional fees are rolled into the loan or are reflected in a higher interest rate.
"If an athlete suffers severe injury, they may need to first see a physiotherapist before beginning sports rehabilitation."
Probably the most important part of being a missionary is to remain flexible.
The administrative staff members within the Department of Psychiatry have been developing green practices for their offices since January 2008.
"Today, a few small sections of rail can still be seen."
Citizen science programs (for example Redmap) to improve research outcomes.
"Frances Grey and her husband had raised Jane to be the future Queen of England, hoping Edward would marry her."
He estimated his plan would save taxpayers up to $1 billion.
Robert often draws his material from a subject he knows well; Native American culture.
The first topic they addressed was engaging management in the task of risk management.
"In this section you can access publications, handouts, webinar recordings, educational tutorials, and other resources."
Sexual abuse of their children by strangers is a concern of every parent.
"The temple has numerous shrines, with those of Annamalaiyar and Unnamalai Amman being the most prominent."
"At the same time, Piaget continued to invest in the domain of research and development."
"Clean foods are an extension of farm-to-table practices, which seek to source food ingredients from local sources."
"This is the meaning of knowing God in Spirit, in Truth."
"Policy statements about normative or ideal conduct become useful when they are explained, elaborated upon, and illustrated with examples."
Case managers conduct initial intakes and help residents acclimate to permanent housing.
The teacher picked up a paper containing the questionnaire on birds.
A single computer could thus be a client in one situation and a server in another.
Even the NAACP has released a statement rejecting charter schools.
"To control spread in young trees, cut new growth of side branches halfway back in late spring."
Plant in groups of 3 or 5 spaced at 150mm apart.
This figure is true for participants diagnosed with type 1 diabetes between 1965 and 1980.
The Portsmouth Police Department has responded to 21 non-fatal drug overdoses to date in 2018.
This lab can be used at lower levels to demonstrate simple properties of heat transfer and convection.
"Photograph of the Los Angels Fire Department's Company 14 horse-drawn fire engine, ca.1910."
Development of Collaborative Learning Assessment Tool with Multivariate Analysis Applied to Electronic Discussion Forums.
We will explain how pump selection is made when we cover septic pressure system calculations a little later.
This is then included in the digital file used to produce the plaster model.
Have students read-to-self every Friday with flashlights in the darkened classroom!
"To learn more about the project, visit the Campus Conversation on Values page."
Due to noise abatement considerations aircraft can't be turned until they're past the end of the runway.
In Windows 10 it is starting automatically when the operating system starts.
Let's look at several examples of causes and cures of hum related to electric guitars.
"He served in an Army unit made up of Japanese-Americans, and his battalion was the most decorated unit of war."
What is the worst that could happen during the event?
"Therefore, medically supervised detox does not cure addiction, nor does it treat it."
This Manual is expected to clear the theoretical concepts behind each experiment of Pharmaceutical Chemistry II.
Possibly this is the source of the statement about the kairos in Mark 1:15.
Full documentary series on the 7 signatories of the 1916 Easter Proclamation.
I compiled a list of protein sources and their corresponding protein grams and calories.
What types of waste do you want to dispose of?
"If it was intended as a critique of racism or colonialism, it doesn't work."
Studies show that music is becoming increasingly popular in treating PTSD and traumatic brain injury.
"In this work, we will discuss the concept of this detector and summarize the status of the R&D."
An address is the location of a computer or computer resource on the Internet.
"The flower opens only for a short time during the late morning, as the spring sun spreads its warmth."
Studies have shown that uncertain wheel check positions increase the observation period by only 5.5%.
We must also defend them out of respect to those who obtained them for us.
"In other words, less than 14% of income is generated from the farm, itself."
The MPEG-4 standard also offers the possibility of defining an expression.
Once they have the data in C# they can do whatever they want with it.
"Saliva was collected with a cotton swab (Salivette Sarstedt®, Nümbrecht, Germany) which was chewed for one minute."
Pure antimony is a white metal which breaks or snaps easily.
"As of 2008 the state forest encompasses 160,000 acres (65,000 ha), mostly in Tioga County."
The NanoTech User Facility (NTUF) houses leading-edge instruments for characterization and fabrication at the micro- and nanoscales.
"According to members of the community, it was closed down at the request of China in 2006."
"In the meantime, Nicholas says, counties could create special taxing districts at sites of new development."
We've got roads and bridges in and around our national parks in need of repair.
"In the following, we will only discuss the tactile measurement methods by means of an exemplary presentation of various devices."
"He first drains the water and then kneads mud and clay, shaping it into raised borders with his bare hands."
As the flood waters fall the seal returns back to its original shape.
"The Faulkner family line has been in America since the 1600's, origin Wales."
That's a pretty big problem because people generally cannot live off 40% of their income.
Results could strongly influence the design of future fusion reactors.
Learn more about what we can offer in terms of outpatient addiction.
"It helps understanding the importance of others in our lives as, alone, we are close to nothing."
"Along the Mitheithel and the Anduin and its tributaries, windows had been uniformly screened that they not be easily detected."
"And now, all this government has in store for us is massive investment in nuclear energy."
The outside parts of the system need drained and the other parts need the water blown out of them.
"First of all, assess what it is that needs to be kept in the bathroom for convenience."
"Zambia experienced a bumper harvest in 2007, which helped to boost GDP and agricultural exports and contain inflation."
"For example, let's extract the first line of the address (i.e., the street)."
"If finalized by the elected officials, the taxpayers of these communities may have the opportunity to vote on this plan."
"The area was named after Tun Dr Ismail bin Abdul Rahman, Malaysia's Deputy Prime Minister in the 70s."
Adam Voigt: Changing context is a start to changing student behaviour.
Learn basic techniques and skills to help improve your tennis game.
This means that their other products may contain cocoa that is produced using slave labour.
"The world is teetering on extinction, and they may very well be the cause of it."
Enteric Rhythm Management (ERM) The benefits of the present invention are illustrated in FIG.
There has been some speculation as to whether the specimen was collected before Labillardière collected his.
That's 688 sq inches = 0.444 sq meters of surface area.
Q: How did you become interested in medicine and public health?
"Liberty presumes an autonomy of self that includes freedom of thought, belief, expression, and certain intimate conduct."
This behavior has been shown by means of optical microscopy (OM) with crossed polaroids.
Identify and count the six triangles that form the bows in the kite's tail.
"Most of these living quarters lacked sewer or water hookup, were filthy and had poor ventilation."
"A classroom session will review key course setting concepts, rules and safety."
"According to a new study, it might be helping you prevent skin cancer!!"
The reason for this is primarily that the FOMC members expect unemployment to drop faster than forecasted by the CBO.
Question: Why the heck isn't Chinese being taught in every single US school?
What can be done to stop and prevent this from happening?
Numerous special features will aid readers in their comprehension of the material.
The light was equipped with a kerosene-powered fog horn in 1906.
In between houses you can see wetlands tall reeds and twisted trees in standing water.
"But the thousands of relatives of the nearly 3,000 victims have no single representative and no unified voice."
These are questions that children (and adults) often ask themselves.
Federal investigators will be looking into many factors to determine the cause of a plane crash in Monroeville Sunday afternoon.
That's because a parrot lives best when living with other parrots.
"However, hidden sources of gluten are abundant in many packaged goods from soy sauce to spice mixes, to breath mints."
The coverage presented by participating insurers is designed to meet the insurance needs of a majority of consumers.
"The Department of Science is an integral and important part of Baba Farid College, Bathinda."
"Pour some of the water into the upper tank, (just an inch or so), and adjust the drip speed."
"Numbere 1, 5 and 6 were all built in 1916."
You will learn to see the person in a different way.
"You may have to wait days, months, or years for your transplant."
The highest possible rating is five stars; the lowest is one star.
"A new republic was founded under the charismatic Dominican friar, Girolamo Savonarola, that same year."
The theoretical framework proved to be relevant for studies in PHC.
Siva and Sakti are the first parents in the Hindu pantheon of gods.
Restorative Justice is a restorative practice that is used after a crime or wrongdoing has occurred.
"In this work, the researchers describe a front view of the structure as looking like an axe."
Students created designs for one of the bus stops in our community.
"Tree-mendous: Oak Grove, White Mountains, Sierra Blanca, Arizona in 1873."
The Universidad Nacional Autónoma de México has graduated 15 M.S.
"For the moon, the light-time correction is about one second."
And even with the advancement of quantum-computing SHA-256 encryption is still far away from being broken.
What are the types of domain names (extensions or suffixes)?
The whole purpose of life is to make God a reality.
"Historically, this herb would be strewn on the floor to repel fleas and other pests."
What causes sharp pain in the left side of the abdomen and vomiting?
It can result in paralysis that lasts several weeks and usually requires intensive care.
Give rich people tax rebates and blame poor people for dragging down the economy.
The prayer is one of the highest forms of charity.
"Perchlorates are especially suited to the process, according to the scientists."
"During this period, British Columbia gained a net total of 40,512 seniors."
It also creates a neural pathway to reinforce future recall.
"Over the last three months, 48 American civilian contractors died in Iraq and Afghanistan."
What if your gradebook could show you which activities a student was likely to complete or likely to avoid?
"Instead of excavating trenches across your lawn and driveway, consider trenchless pipe lining."
"Besides, it is allowable to add other organic layers (a hole barrier layer, an electron barrier layer or the like)."
They're made in Illinois by the descendants of a French beekeeper who settled there in 1863.
"Thus, the Oregon statute now likely affords immunity from suit, as California's does."
"Created by two dedicated collectors, the Russell-Cotes is a museum of national importance."
Here the Electroacustic GmbH has actually penned a short chapter on German industrial history.
"The samples were washed again to eliminate uncoupled materials, and the conjugates were checked by SDS-Page electrophoresis analysis."
"In situations like this, the colour cast is an important part of the moment and the image."
"This is clear not only from the Supreme Court's legal reasoning, but also from the most basic economic logic."
"In addition, Altru Health System offers treatment solutions for patients with ear, nose and throat problems."
"Nevertheless, it is safer compared to the various other drugs or supplements."
"In more than 30,000 words, he explained that the Mass is absolutely necessary for our salvation."
"Apart from Albanian they also talked Turkish, the lingua franca of the time."
Creatine monohydrate is a well-absorbed and stable form of creatine.
"We all have no objection to paying our fair share of taxes, but what is a fair tax?"
"Flu shots are available at many physicians' offices, health clinics and pharmacies."
This procedure involves elevating the soft tissue of the cheek in this area.
This is a presentation designed for those in the medical field.
They had suffered years of prejustice from society till they discovered how their bodies reacted to sugar and starches.
National Center For Constitutional Studies - [URL] Educates people in restoring America's original principles.
The neighbors will have rights to sue if they find unauthorized construction in the tiniest part of their land.
"For starters, this organic burial process does away with toxic embalming fluids."
The Civil War brought prosperity to the local area; Barrington's population increased to 300 by 1863.
It's a database program for coin collectors to catalog their collection of coins.
"Included are several experiments that help establish your everyday experience as awareness, always and already."
